{
  "$schema": "https://json-schema.org/draft/2020-12/schema",
  "type": "object",
  "required": ["home", "inputPanel", "settingsPanel", "progress"],
  "properties": {
    "home": {
      "type": "object",
      "required": ["title", "subtitle"],
      "properties": {
        "title": { "type": "string" },
        "subtitle": { "type": "string" }
      },
      "additionalProperties": false
    },
    "inputPanel": {
      "type": "object",
      "required": ["title", "description"],
      "properties": {
        "title": { "type": "string" },
        "description": { "type": "string" }
      },
      "additionalProperties": false
    },
    "settingsPanel": {
      "type": "object",
      "required": ["title", "description"],
      "properties": {
        "title": { "type": "string" },
        "description": { "type": "string" }
      },
      "additionalProperties": false
    },
    "progress": {
      "type": "object",
      "required": ["runningTitle", "runningDescription"],
      "properties": {
        "runningTitle": { "type": "string" },
        "runningDescription": { "type": "string" }
      },
      "additionalProperties": false
    }
  },
  "additionalProperties": false
}
