{
  "home": {
    "title": "诗词鉴赏",
    "subtitle": "品味诗词之美，探寻意境之深"
  },
  "inputPanel": {
    "title": "诗词输入",
    "description": "输入待评价的诗词作品。"
  },
  "settingsPanel": {
    "title": "评价设置",
    "description": "配置评价视角与关注维度。"
  },
  "progress": {
    "runningTitle": "正在进行诗词鉴赏分析...",
    "runningDescription": ""
  }
}
